{
    "materials": {
        "default": {
            "properties": {
                "conductivity": 1.0,
                "density": 1.0,
                "specific-heat": 1.0
            }
        }
    },
    "mesh": {
        "x-axis": {
            "coarse-grid": [0.0, 0.25, 1.0],
            "intervals": [2, 6],
            "ratio": [1.0, 1.2]
        },
        "y-axis": {
            "coarse-grid": [0.0, 1.0],
            "intervals": [8]
        },
        "element-type": "quad",
        "triangle-probability": 0.35,
        "noise-factor": 0.0,
        "coord-scale-factor": 1.3,
        "rotation-angle": 17.0,
        "partitioner": "block"
    },
    "ht-model": {
        "bc": {
            "all-sides": {
                "type": "flux",
                "face-set-ids": [1, 2, 3, 4],
                "flux": 0.0
            }
        }
    },
    "ht-solver": {
        "initial-condition": {
            "rel-tol": 1.0e-6,
            "max-iter": 100
        },
        "preconditioner": {
            "method": "BoomerAMG",
            "params": {"num-cycles": 1}
        },
        "error-norm": {
            "temp-rel-tol": 1.0e-6,
            "enth-rel-tol": 1.0e-6
        },
        "integrator": {
            "nlk-max-iter": 10,
            "nlk-tol": 0.01
        }
    },
    "sim-control": {
        "initial-time": 0.0,
        "initial-time-step": 1.0e-3,
        "min-time-step": 1.0e-6,
        "output-times": [0.01]
    },
    "initial-temperature": {
        "type": "polynomial",
        "poly-coef": [2.0],
        "poly-powers": [[0, 0, 0]]
    }
}
