{
    "materials": {
        "default": {
            "properties": {
                "conductivity": 1.0,
                "density": 1.0,
                "specific-heat": 1.0
            }
        }
    },
    "mesh": {
        "x-axis": {"coarse-grid": [0.0, 1.0], "intervals": [8]},
        "y-axis": {"coarse-grid": [0.0, 1.0], "intervals": [8]}
    },
    "ht-model": {
        "bc": {
            "left": {
                "type": "temperature",
                "face-set-ids": [1],
                "temp": 1.0
            },
            "right": {
                "type": "temperature",
                "face-set-ids": [2],
                "temp": 0.0
            },
            "bottom-top": {
                "type": "flux",
                "face-set-ids": [3, 4],
                "flux": 0.0
            }
        }
    },
    "ht-solver": {
        "preconditioner": {
            "method": "BoomerAMG",
            "params": {"num-cycles": 1}
        },
        "error-norm": {
            "temp-abs-tol": 1.0e-10,
            "temp-rel-tol": 1.0e-6,
            "enth-rel-tol": 1.0e-6
        },
        "integrator": {
            "nlk-max-iter": 10,
            "nlk-tol": 0.01
        }
    },
    "sim-control": {
        "initial-time": 0.0,
        "initial-time-step": 1.0e-3,
        "min-time-step": 1.0e-6,
        "output-times": [0.01]
    },
    "initial-temperature": {
        "type": "tabular",
        "tabular x": [0.0, 1.0],
        "tabular y": [1.0, 0.0]
    }
}
