{
    "materials": {
        "inclusion": {
            "properties": {
                "conductivity": 4.0,
                "density": 2.0,
                "specific-heat": 3.0
            }
        },
        "matrix": {
            "properties": {
                "conductivity": 1.0,
                "density": 1.0,
                "specific-heat": 1.0
            }
        }
    },
    "material-regions": {
        "inclusion": {
            "material": "inclusion",
            "type": "disk",
            "center": [0.5, 0.5],
            "radius": 0.3
        },
        "matrix": {
            "material": "matrix",
            "type": "background"
        }
    },
    "mesh": {
        "x-axis": {"coarse-grid": [0.0, 1.0], "intervals": [8]},
        "y-axis": {"coarse-grid": [0.0, 1.0], "intervals": [8]}
    },
    "ht-model": {
        "bc": {
            "all-sides": {
                "type": "flux",
                "face-set-ids": [1, 2, 3, 4],
                "flux": 0.0
            }
        }
    },
    "ht-solver": {
        "preconditioner": {
            "method": "BoomerAMG",
            "params": {"num-cycles": 1}
        },
        "error-norm": {
            "rel-t-tol": 1.0e-6,
            "rel-h-tol": 1.0e-6
        },
        "integrator": {
            "nlk-max-iter": 10,
            "nlk-tol": 0.01
        }
    },
    "sim-control": {
        "initial-time": 0.0,
        "initial-time-step": 1.0e-3,
        "min-time-step": 1.0e-6,
        "output-times": {"times": [0.0, 0.01] }
    },
    "initial-temperature": {
        "type": "polynomial",
        "poly-coef": [2.0],
        "poly-powers": [[0, 0]]
    }
}
